context,question,answer
The Faculty of Science at KMC provides advanced and comprehensive knowledge and aims to create a strong foundation for various career paths such as medicine, engineering, agriculture, forestry, and scientific research.,What careers can I pursue with a Science degree from KMC?,KMC's Science program creates a strong foundation for careers like medicine, engineering, agriculture, forestry, and scientific research.
The Department of Management at KMC focuses on providing in-depth knowledge of management and its main objective is to produce future managers and chartered accountants.,What is the goal of the Management Department at KMC?,The main objective of the Management Department is to produce future managers and chartered accountants.
The Management curriculum at KMC emphasizes competitive examinations such as CA (Chartered Accountancy) and BBA (Bachelor of Business Administration).,Does KMC Management prepare students for competitive exams?,Yes, the Management curriculum emphasizes preparation for competitive examinations such as CA (Chartered Accountancy) and BBA (Bachelor of Business Administration) courses.
The Department of Law at KMC was established in 2019 and focuses on providing in-depth knowledge of law to produce future law professionals.,When was the Law department established and what is its goal?,The Law department at KMC was established in 2019, and its goal is to produce future law professionals.
KMC has international relationships with institutions such as Georgia Southwestern State University (USA) and Mokpo National University (South Korea).,Does KMC have international partners or universities it works with?,Yes, KMC has international relationships with institutions including Georgia Southwestern State University (USA) and Mokpo National University (South Korea).
KMC's overall mission is to set students up for success in a career, helping them discover a field they are passionate about.,What is KMC's philosophy or mission regarding student careers?,KMC aims to set students up for success in a career and help them discover a field they are passionate about and dare to lead.
The curriculum not only covers the National Examination Board (NEB) syllabus but also focuses on competitive examinations for law courses at the bachelor's level.,Does the Law program cover more than just the NEB syllabus?,Yes, the Law curriculum covers the National Examination Board (NEB) syllabus and focuses on competitive examinations for law courses at the bachelor's level.